,title,score,id,url,comms_num,created,body,ups,downs
0,Intrusive thoughts and ruminating,11,du85h6,https://www.reddit.com/r/OCD/comments/du85h6/intrusive_thoughts_and_ruminating/,7,1573368479.0,"23yr old F, in a relationship. Going a little bit crazy so I have to vent about wondering if I’m secretly a pedophile after thinking a girl in a movie was attractive. (The actor plays a 15 year old). I looked her up and the actor is 18 but that doesn’t make me feel any better. It’s hard just to write this with the shame that’s attached. Additionally, I am friends on fb with a youth I worked with (who turned 18 around the time my practicum was ending) and I’m worried I’m attracted to them too.",11,0
1,Music Playing in My Head Almost Constantly,19,du8s5x,https://www.reddit.com/r/OCD/comments/du8s5x/music_playing_in_my_head_almost_constantly/,10,1573373179.0,"Does anyone else experience this? I have music playing in my head almost constantly. Sometimes they're songs that I've heard. Sometimes it's music that I've never heard before and I'm just making it up in my head.

&#x200B;

When it's not a song that I've heard before, and I'm just making the song up, it just goes on and on like a compulsion, and I have this feeling that I just HAVE to make the song and it has to sound perfect. It also appears in my behavior. I shake my leg to the rhythm of the song I'm making. I swish the saliva around in my mouth to the rhythm. I tap my fingers on a desk to a drum beat.

&#x200B;

For the most part it's not particularly bothersome, but it's become a lot more noticeable recently. I do enjoy the music I make in my head. It's just mildly distressing when I realize that I just can't stop it.",19,0
2,I think I know what triggers my anxiety,11,du8v03,https://www.reddit.com/r/OCD/comments/du8v03/i_think_i_know_what_triggers_my_anxiety/,2,1573373802.0,"I have been feeling anxious for nearly 4 years now and I have discovered that my anxiety spikes when something good happens to me. I think it stems from poor self esteem, as some really great things have happened to me in those 4 years and they have all followed by obsessions that make me feel like I don't deserve any of it.",11,0
3,Fed up rant,47,du958s,https://www.reddit.com/r/OCD/comments/du958s/fed_up_rant/,13,1573376131.0,"I’ve honestly had it with this illness. At the risk of sounding like an ungrateful whiny bitch, nobody I know has any idea what the fuck I go through each and every day. It takes all my effort just to be a barely functioning person, it’s taken me months to even get to a level of stability where I can begin to work on myself again. Every time I start to feel better though, my brain invents some new reason for me to give up. It’s always one step forward, two steps back. And I know everyone has their own shit going on too but god damn, this illness is debilitating. It just sucks the joy out of everything, which makes it that much harder to get yourself on the right track when everything seems to be working against you. Sorry for the rant, it just makes me so angry sometimes, it’s unfair and it’s cruel. I have so much respect for anyone battling with ocd, depression, anxiety, or schizophrenia, I know how rough it can get, hang in there guys.",47,0
4,I just saw a documentary on somebody with OCD and I’m pissed.,171,dua0ii,https://www.reddit.com/r/OCD/comments/dua0ii/i_just_saw_a_documentary_on_somebody_with_ocd_and/,89,1573382848.0,"At the end this guy just said that his OCD was part of him and that he’d never change it. He just put a posotive spin on OC-BLOODY-D! It’s just trivializing the whole idea of OCD and it’s just so annoying, no, it’s wrong! It makes people think that life with OCD is hard but we somehow love it?!
#What the actual fuck is this dude saying. I want him to go off the dumb ass script that he’s obviously been given.
I hate stuff like this and sorry for the big letters.",171,0
5,Rewinding when watching TV series,15,dub18x,https://www.reddit.com/r/OCD/comments/dub18x/rewinding_when_watching_tv_series/,10,1573390138.0,[deleted],15,0
6,You Are A Good and Loveable Person (To those coping with Pure O),131,dubsa6,https://www.reddit.com/r/OCD/comments/dubsa6/you_are_a_good_and_loveable_person_to_those/,24,1573394593.0,"**Introduction**  
Pure OCD primarily comes down to an internalised sense of being a bad person  


So perhaps one way to beat O is to make a habit of affirming to yourself that you are actually a good person?  


i.e. When you wake up, go have breakfast + brush your teeth\*, and then before you eat your breakfast just pause and be present for a few moments/minutes as best as you can, and just calmly tell yourself ""I am a good person"", then sit with that for a few moments, and then eat your breakfast. How about that? Maybe something like that can actually work to defeat ocd  


I dont know, I have the slight feeling that the above suggestion sounds like a compulsion or a ritual so maybe thats not the best way? But it seems like a perfectly positive ritual at least..  


Basically, reminding yourself you are a good and loveable person throughout the day in some fashion, is what I am suggesting..  


Another great thing is mindfulness, I think if I had no interest in mindfulness/meditation then the effects of OCD would have been a lot worse by now. I only really started to understand what is and isnt mindfulness about a few weeks ago though, but now I feel as though I properly get what its about.   


I have been succesfully practicing mindfulness for about a week, and it removed (at least!) 50% of the anxiety I was experiencing, and then yesterday I drawn straight back into it, into the unconsciousness.  Why did this happen?  


When it comes to Pure OCD sufferers, including myself, I am certain that what the school of life said in their video is correct. Namely that it comes down to having a really strong unconscious belief that we are bad people, and so as a result we are constantly seeking out things to confirm this, because its a natural psychological process to seek out evidence which confirms our \*individual sense/image of self\*. In pure O sufferers, at some point in the past this sense of self was traumatized or damaged in some way, and the person started unconsciouslly believing themselves to be bad people, and colouring all of their thoughts adn experiences in this point of view. After all, everybody has intrusive thoughts ocaisonally, im not sure how often in non ocd sufferers, but the essential difference is those people just see the thought as random and move on, but O sufferers automatically go ""Look! See! That evidence that I AM xyz"" and then the fighting aspects of self one of which is saying ""No you arent, look, that was a meaningless thought.."" and the aspect of self saying ""No we already KNOW we are a bad person this is EVIDENCE"" start fighting, and this is basically what causes an OCD meltdown. Which I experienced yesterday and it was completely horribly deblitating.  


This is the thing. The wider public has NO IDEA how debilitating pure O is, its a really serious issue and it is NOT discussed properly in the public space. Eugh.  


Anyway the above would be my theory of the mechanism behind this, and the point of this post is im saying you (we) need to LOVE YOURSELF. Its the unconscious programming that you are by default bad which is generating this entire psychological pattern, that I am also experiencing.  


Love Yourself.  


**Thesis**  


The way to beat OCD is to slowly unlearn the unconscious belief that you automatically have something to feel ashamed of. How this is to be achieved, I am yet to clearly ascertain, leading to:  


**Question/Discussion**

I have not had therapy, so other than ERP I am not aware of therapeautic practices aimed at treating O; what are other common methods/therapeautic responses to pure O? And how would you simply explain and evaluate them? How would you do the same for ERP?  


My central thesis is that O needs to be overcome by unlearning unconscious beliefs that you are automatically a bad person, which leads to unconscious evidence seeking that you are, which causes anxiety and uncertainty, which fuels the OCD loop, blah blah blah.    


how would you critically evaluate that thesis, and, in so far as you do support its essential claim, how best, in your view, should one incorporate some a practice of reminding themself they are a good person into their life? 

What are some creative ways in which one can remind themself they are a good person?   


Much Love  
Have a Wonderful Day  
Dont tell yourself you are bad",131,0
7,Anyone get flashes of death panic ?,19,duewnp,https://www.reddit.com/r/OCD/comments/duewnp/anyone_get_flashes_of_death_panic/,7,1573409366.0,"Like, I'm sitting on the bus looking out the window and then the concept of death hits me and I have this mental error and it makes me want to physically move, shake, or scream to get as present and alive as possible, as if it's fighting non existence somehow.

I hate it, the mindfuck of death. Surreal",19,0
8,"[Warning: potentially triggering] For people with intrusive thoughts, what is the weirdest intrusive thought you have had?",11,dug8mw,https://www.reddit.com/r/OCD/comments/dug8mw/warning_potentially_triggering_for_people_with/,43,1573414994.0,,11,0
9,Do any of you worry about supernatural things?,10,duh9hl,https://www.reddit.com/r/OCD/comments/duh9hl/do_any_of_you_worry_about_supernatural_things/,8,1573419277.0,Do any of you worry about supernatural things that you used to believe in but no longer do? I'm just curious because it's happened to me recently.,10,0
10,Does it annoy you that your friends don't understand your OCD?,12,dujite,https://www.reddit.com/r/OCD/comments/dujite/does_it_annoy_you_that_your_friends_dont/,8,1573429242.0,[deleted],12,0
11,All lies!,75,dujy00,https://i.redd.it/q9kpyiky8yx31.jpg,2,1573431097.0,,75,0
12,PLEASE tell me how to get the red dot to go away. Not a troll post. I have no read messages and this is driving me up the wall. I'm gonna cry please help,11,duk0rx,https://i.redd.it/rp2wgcsy9yx31.png,3,1573431439.0,[deleted],11,0
13,A big thank you to this community 💜,17,dukqae,https://www.reddit.com/r/OCD/comments/dukqae/a_big_thank_you_to_this_community/,1,1573434719.0,"This community has helped me a lot. 

I’ve been battling OCD for some years now. 

I’ve had some lows where my intrusive thoughts took the best of me. They would fill me with shame and fear. 

Then I found this community, and I read someones post or comment here and think “I’m not alone!!”.

So I want to say THANK YOU everyone for sharing your struggles and experiences or giving words of sympathy and encouragement. 🌸 I’m still a bit ashamed to go into detail on some of the things I feel, but feel nontheless very supported by this community. Thank you all 💜 *big virtual hug*",17,0
14,"Do any of you also feel like you are constantly lying even when you know you aren’t, that everyone thinks you are lying, and that people are pretending to believe you? I don’t know if this is OCD but my old therapist said it was. I thought I’d see if any of you have dealt with this too.",25,dulxsf,https://www.reddit.com/r/OCD/comments/dulxsf/do_any_of_you_also_feel_like_you_are_constantly/,4,1573440394.0,[deleted],25,0
15,beating ocd with one dinosaur sticker at a time! (follow up from my last post here),16,dumqdd,https://i.redd.it/maw27q8ybzx31.jpg,0,1573444238.0,,16,0
16,Does anyone else's intrusive thoughts get way worse when they are doing something related to their hobbies?,10,dunijv,https://www.reddit.com/r/OCD/comments/dunijv/does_anyone_elses_intrusive_thoughts_get_way/,3,1573448283.0,"I used to draw constantly but now whenever I do, I get really bad intrusive thoughts of like, ""if you post this, people will think you're a complete weirdo"" and ""people will misunderstand this and itll be BAD""  
and a lot of ""that line is off, fix it or Bad Things will happen"".  

which, these seem generally normal for an anxious artist, but i just cant avoid it and just give up bc its too much.",10,0
17,Great way to start the day,66,duojnm,https://i.redd.it/cbf004k660y31.jpg,3,1573454407.0,,66,0
18,Ouch,483,duomto,https://i.redd.it/2x1g8wix70y31.png,10,1573454969.0,,483,0
19,Some good news I wanted to share,39,dxgpmd,https://www.reddit.com/r/OCD/comments/dxgpmd/some_good_news_i_wanted_to_share/,1,1573957512.0,"A compulsive habit that has crippled me in the last 6 years is the need to be listening to something at all times to avoid painful thoughts. In the last few months my two pairs of earbuds, my headphones, and wireless beats earbuds have all broken or become defective enough that they can’t be useable when moving around doing things. 


Because of this, I’ve had to be part of the world around me and have already become closer with my roommates and can go running without music again like I used to. I still need things playing almost all of the time, but it gave me hope when I saw that I can exist with just myself, and what I’m so afraid of isn’t all that bad.",39,0
20,❤,133,dxhq3g,https://i.redd.it/5x2cu0m966z31.jpg,3,1573962893.0,,133,0
21,The physical effects of my OCD.,12,dxi3qj,https://www.reddit.com/r/OCD/comments/dxi3qj/the_physical_effects_of_my_ocd/,8,1573965107.0,"I have to wash my hands upwards of 15 times per day with dish soap. This is what's happened to them. Fuck this fucking disease, my therapist saw my hands and just put her hand over her mouth. I'm so fucking tired of it, I'm tired of pain. I can't use moisturizer because I'm phobic of oily things, hence how they managed to get so bad.

Next time someone makes an OCD joke, fuckin show them this picture of my corpse hands. 

https://preview.redd.it/62v2j3fqc6z31.jpg?width=3024&format=pjpg&auto=webp&s=c238186b07a95761b077140158755045bf031095",12,0
22,Fuck OCD and mental illness.,27,dxiygo,https://www.reddit.com/r/OCD/comments/dxiygo/fuck_ocd_and_mental_illness/,4,1573970639.0,[deleted],27,0
23,OCD is so exhausting,10,dxja7h,https://www.reddit.com/r/OCD/comments/dxja7h/ocd_is_so_exhausting/,5,1573972903.0,OCD and depression have taken a toll throughout the years. I've done ERP and taken meds for a long time so I'm not new to the process. It just gets exhausting dealing with it everyday. Rant over and stay strong.,10,0
24,Normally not 'that guy' but can this stop?,104,dxm5fx,https://i.redd.it/884cobtdt8z31.png,15,1573994890.0,,104,0
25,What the fuck is wrong with people who make this stuff?,403,dxmxh0,https://i.redd.it/5vrkbowe79z31.png,177,1573999628.0,,403,0
26,"Girlfriend has OCD and deals with it partially by hugging a specific pillow and fiddling with the tag, but i'm not sure what would happen if that suddenly wasn't possible anymore.",14,dxna27,https://www.reddit.com/r/OCD/comments/dxna27/girlfriend_has_ocd_and_deals_with_it_partially_by/,3,1574001501.0,"So basically a while back on the train someone stole her bag. There was nothing of monetary value in it but her ""cuddle pillow"" was in there. When we discovered the bag was gone she just completely lost it and started crying in a state of uncontrollable panic. Since there was nothing valuable however the thief dropped the bag somewhere else in the train. Presumably he didn't wanna look suspicious for some clothes and a pillow. But that moment did make me think. Does anybody have any advice on how to deal with the pillow disappearing or beclming unusable? It's old so i don't give it a lot more time, and finding an exact replacement seems to be impossible.",14,0
27,"Women with OCD, do symptoms get worse before/during period?",13,dxonc4,https://www.reddit.com/r/OCD/comments/dxonc4/women_with_ocd_do_symptoms_get_worse_beforeduring/,13,1574008296.0,[deleted],13,0
28,Anyone else obsess over disturbing movie scenes they’ve watched?,30,dxpnes,https://www.reddit.com/r/OCD/comments/dxpnes/anyone_else_obsess_over_disturbing_movie_scenes/,28,1574012485.0,"The thoughts from a very disturbing movie that I watched years ago popped into my head two days ago and the graphic images keep resurfacing. My OCD mostly relates to harm OCD so when I think of the disturbing scenes it almost does a double whammy on me because I become both traumatized and triggered at the same time lol.

Does anyone else get this with disturbing/violent films they’ve watched? I’ve been trying not to react to the thoughts but it’s hard with the scenes being so vivid... any advice or experiences would be appreciated!",30,0
29,Pure ocd thoughts wont leave me alone,16,dxts3t,https://www.reddit.com/r/OCD/comments/dxts3t/pure_ocd_thoughts_wont_leave_me_alone/,12,1574029889.0,"I always having thoughts of killing or stabbing my classmates,strangers, and my own family or going crazy in public or class. I feel so disgusting thinking those things or getting the urges to do those things. Because of these thoughts I've had suicidal thoughts and I'd rather hurt myself even if I dont want to.",16,0
30,Feel like ocd is killing me right now,13,dxwll5,https://www.reddit.com/r/OCD/comments/dxwll5/feel_like_ocd_is_killing_me_right_now/,7,1574043060.0,"Hey everyone, I just need to vent. I’ve been having the worst weekend in a long time. For months I’ve felt like I had ocd under control. And by under control I mean I’ve been giving into “rituals” in my head in order to do what I needed to do. But now I feel like it’s all backfired. And the worst part is that i need to get something very important done and i just can’t because of these rules I’ve created for myself to appease ocd. I’ve been so stressed and scared that the fear is now affecting me physically. I feel pain and shortness of breath in my chest and my shoulders. I’m sure many of you might be familiar with this feeling but it’s the absolute worst! I don’t feel any peace. I don’t feel calm. I’m in so much pain and worry. Even writing this is triggering me. I felt like this months ago and it lasted for a long time and I fear it will last a long time this time too. I’m fed up with ocd. I hate it so much. Im angry and frustrated and stressed. I know this will pass eventually but right now if all feels awful. I feel so trapped. Most of the time ocd is under control and I feel mostly normal (although never 100 % normal like a person with no ocd.) but once in awhile I get myself in a ocd hole and I can’t get out. And it becomes debilitating. I start to feel like I’m suffering. I’m just in so much pain right now.",13,0
31,Does anyone else get thoughts that just ruin a great day?,60,dxwzri,https://www.reddit.com/r/OCD/comments/dxwzri/does_anyone_else_get_thoughts_that_just_ruin_a/,11,1574044918.0,[deleted],60,0
32,One of the most relatable videos I've found on OCD,271,dxzlje,https://youtu.be/qc4sdCcrXso,14,1574059676.0,[deleted],271,0
33,I hate how many articles online there are written by people without any expertise that can confirm ANY biased OCD thought. Worried your BF is a psychopath? Well there's 10 articles saying he definitely is. Thanks google!,35,dy4n1z,https://www.reddit.com/r/OCD/comments/dy4n1z/i_hate_how_many_articles_online_there_are_written/,17,1574090952.0,"I know the answer is to *stop* looking for affirmation and answers, but I can't help but think that the world before this ""freedom of information"" must have been pretty nice. Yeah you could get books or papers, but there were more gatekeepers for content. Nowadays anybody with an opinion can say something - and no matter *what* my obsession is, guaranteed if I search it, I'll find articles that help strengthen it...

How do you cope with this? Do you have a mental checklist before you google?

- Is this a real question, or am I obsessing?
- Can google REALLY answer this question?

I can't even imagine the people who are bothered by fear of having medical problems... WebMD must be a freaking MINEFIELD.

Not really looking for ""help"" here just discouraged, and I'd imagine others are too.",35,0
34,Is anyone else just tired all the fucking time?,51,dy4zwa,https://www.reddit.com/r/OCD/comments/dy4zwa/is_anyone_else_just_tired_all_the_fucking_time/,21,1574092566.0,"From the minute I wake up I feel tired and it slowly get worse throughout the day, anyone else get this? Is it an OCD thing?",51,0
35,Stay strong friends,759,dy5k03,https://i.redd.it/sri4z2og2hz31.png,21,1574094976.0,,759,0
36,"All warriors strive for peace, but damn is it hard to get",30,dy6r3k,https://i.redd.it/cp3tgkz6ihz31.png,0,1574100082.0,,30,0
37,What’s your superpower?,14,dy9b05,https://i.redd.it/66k3sl9tciz31.jpg,1,1574110377.0,,14,0
38,Can you have OCD on a person?,13,e0rp2k,https://www.reddit.com/r/OCD/comments/e0rp2k/can_you_have_ocd_on_a_person/,3,1574559281.0,"I was wondering if you can have OCD on a person. I think I might have something similar.
This person is a family member. I love her a lot. But I can't eat unless I'm sure she does, if she eats, I have to eat less than her. I can't stop thinking aboit her well-being even though I have moved out.
I keep texting my mom about her and asking if she ate or exercised or did anything. 
These thoughts and so on are giving me real bad anxiety and I don't know what to do about it. I can't take it anymore. I'm really tired and it's affecting my relationship with the person I'm with",13,0
39,"Screw you, hobby lobby. I saw this today and it made my blood boil. I HATE when people make jokes about this debilitating illness. And no one ever understands. I’m thankful for this group.",252,e0s97l,https://i.redd.it/06yi75uunj041.jpg,54,1574562051.0,[deleted],252,0
40,Anyone mess up completely normal social interactions due to OCD?,20,e0sdli,https://www.reddit.com/r/OCD/comments/e0sdli/anyone_mess_up_completely_normal_social/,5,1574562648.0,[deleted],20,0
41,I hate this guy,32,e0u8uo,https://i.imgur.com/OENARuc.jpg,2,1574572503.0,,32,0
42,yes I love staring at my bed for an hour or so,677,e0ux0y,https://i.redd.it/xtflhrllvk041.jpg,25,1574576757.0,,677,0
43,Ironic because I’m still awake at 1:45am making OCD memes to cope with the possibility of becoming a serial killer...,241,e0vlxu,https://i.redd.it/ai03kuk4al041.png,18,1574581650.0,,241,0
44,The more bodly I am living the more intrusive thoughts occur (pure o),17,e126y2,https://www.reddit.com/r/OCD/comments/e126y2/the_more_bodly_i_am_living_the_more_intrusive/,1,1574619561.0,[deleted],17,0
45,OCD Support Chat Room Recommendation,10,e12byx,https://www.reddit.com/r/OCD/comments/e12byx/ocd_support_chat_room_recommendation/,2,1574620134.0,"Does anyone have any recommendations on a support chat room that’s free? I have checked out a few on google, but they don’t seem very active.",10,0
46,need to know/research compulsion,31,e12y7p,https://www.reddit.com/r/OCD/comments/e12y7p/need_to_knowresearch_compulsion/,6,1574622580.0,"I'm not sure if anyone struggles with something similar, but I have an extreme need to know everything compulsion and researching compulsion. At the moment, I have a google document of over 160 pages of things that I gotta go through. At the moment, I've been busy with schoolwork, so I've been unable to look through that.

Like Im in college and say if there is a club or some other kind of thing that I'm interested in, I feel the need to google everything about it because I'm like well, I need to know everything about this particular thing. Then after a while, I'm like screw this and I never end up going because I'm just exhausted from the constant research. My mind just goes in circles and circles and circles.

And then I'm like ""what if I didn't see everything, what if I missed something"" and the cycle repeats. This drives me absolutely insane.

&#x200B;

I miss out on so much because of this :(",31,0
47,Sometimes I wonder how much I would have done with my life if I didn't have ocd,220,e144nx,https://www.reddit.com/r/OCD/comments/e144nx/sometimes_i_wonder_how_much_i_would_have_done/,30,1574627370.0,"Like, I have been torn with a lust for new things and to explore but the OCD holds me back.

It makes me sad to think about the past and even know, how much it has kept me from risks and challenges and new things. I've lived so sheltered   and yet it's still hard to know what's legitimate caution.

I want to move, but haven't visited the cities or have a job set up, for example, seems like a smart concern. Or maybe not.",220,0
48,OCD about being or becoming dumb?,12,e14mxs,https://www.reddit.com/r/OCD/comments/e14mxs/ocd_about_being_or_becoming_dumb/,4,1574629386.0,[deleted],12,0
49,I have real event ocd & have been obsessing over an event that happened a month ago with my toxic ex gf,10,e18kg8,https://www.reddit.com/r/OCD/comments/e18kg8/i_have_real_event_ocd_have_been_obsessing_over_an/,2,1574645718.0,[deleted],10,0
50,I was going to vent but can’t write the vent out the “right way”,12,e1aaq0,https://www.reddit.com/r/OCD/comments/e1aaq0/i_was_going_to_vent_but_cant_write_the_vent_out/,1,1574653799.0,"So yet again, I’ll suffer in silence. It’s the most painful thing to not even be able to express how much you are hurting. I’m so deeply pained and I just want be able to express that pain, but the words are never right, and even if that wasn’t  an issue my thoughts are so jumbled that i still wouldn’t be able to get it all out of my stupid cluttered head. 

I do try to write things out, i try to just be ok with the “wrong” words but even when I get that far I end up being too mentally exhausted to finish since it takes so much out of me to just be ok with the “wrong” things. 

I feel utterly alone in this world",12,0
51,Finding this Sub is one of the best things that has happened to me in a long time,19,e1amun,https://www.reddit.com/r/OCD/comments/e1amun/finding_this_sub_is_one_of_the_best_things_that/,2,1574655507.0,[deleted],19,0
