,title,score,id,url,comms_num,created,body,ups,downs
392,If my tinder conversations were honest,10,ghib3e,https://imgur.com/rSW5vET,0,1589178570.0,,10,0
393,"Yup, basically.",13,gl7exy,https://www.reddit.com/r/OCD/comments/gl7exy/yup_basically/,0,1589682033.0,"&#x200B;

[ ](https://preview.redd.it/8ql8zuyaj8z41.png?width=960&format=png&auto=webp&s=b8be70adb83a2b8deaa062adf3da0e971a0ba588)

https://jumpkick.net/i-think-i-left-the-stove-on-im-out-right-now-but-lets-assume-the-worst-and-get-me-a-new-house/?fbclid=IwAR3weWLicgxtNV-jwWdoHp-fjE7CpVPYZGG650g5dVC6R2CwlTZp9u-Firs ",13,0
394,My best friend just basically told me I’m faking my OCD,18,gl9a4z,https://www.reddit.com/r/OCD/comments/gl9a4z/my_best_friend_just_basically_told_me_im_faking/,8,1589690110.0,"I fucking hate people. Then he leaves me on read. All he does is feel bad for himself, fucking piece of shit",18,0
395,OCD discoloring past memories?,10,glbtdq,https://www.reddit.com/r/OCD/comments/glbtdq/ocd_discoloring_past_memories/,3,1589703399.0,"Has anyone else ever had their brain reinterpret a mundane memory with previously no strong emotions attached to it as somehow embarrassing or bad, but if you think about it logically you can't think of a single reason why it would be? Is that a part of OCD?",10,0
396,Does OCD come in waves or is it constant?,17,glbv57,https://www.reddit.com/r/OCD/comments/glbv57/does_ocd_come_in_waves_or_is_it_constant/,7,1589703671.0,[deleted],17,0
397,Going on my first date in over a year. Bring it on!,76,glfvby,https://www.reddit.com/r/OCD/comments/glfvby/going_on_my_first_date_in_over_a_year_bring_it_on/,14,1589724084.0,"After multiple try’s at “getting back out there”, I’m ready to overcome every intrusive thought and have a great time with someone I like very much. I’m excited, scared, nauseas, confident, and internally screaming on the inside. It’s the first time I haven’t felt like backing out or cancelling at the last minute which is what happens most of the time, BUT NOT TODAY SATAN!!!!",76,0
398,This is accurate,913,gljb5i,https://i.redd.it/dcm8ys960dz41.jpg,24,1589736122.0,,913,0
399,"I know it may not mean much and can sometimes seem annoying. But after reading the posts and comments here, all I can say is that I love you all and I am happy I can relate to many of you guys. I really felt lonely, but not anymore.",55,glmpum,https://www.reddit.com/r/OCD/comments/glmpum/i_know_it_may_not_mean_much_and_can_sometimes/,7,1589747367.0,[removed],55,0
400,Has anyone else OCD peaked during lockdown?,37,glr09n,https://www.reddit.com/r/OCD/comments/glr09n/has_anyone_else_ocd_peaked_during_lockdown/,15,1589762003.0,So I’ve been coping surprisingly well with the lockdown (in the UK at least) but I’ve noticed that my OCD has spiked. I’ve been on medication for a few years and it’s kept it suppressed however I’ve noticed compulsions and intrusive thoughts have crept back quite rapidly. Has this been effecting anyone else? Any idea why?,37,0
401,does anyone else feel like they wasted their 20s due to their anxiety/OCD symptoms?,54,gph76q,https://www.reddit.com/r/OCD/comments/gph76q/does_anyone_else_feel_like_they_wasted_their_20s/,33,1590284920.0,"I often get depressed when I think about this. I feel like I should have done more with my 20s, but my anxiety/OCD has held me back a lot. I went through a lot of big changes in my early to mid-20s (bad breakup, family member passed away and guilt associated with it, moving away from my family, falling out of faith, etc.) and that just further compounded my anxiety, making it harder to make decisions about my future. I got my associates degree in 2013, but I was going through those big life changes, and working, and battling anxiety, and being indecisive about what I wanted to study at university, so I didn't finish school. I plan on finishing school but I just feel like I could have done more with my 20s that I wasn't able to. And I'm mourning the lost time.. I know there's nothing to do but go forward. I'm almost 30 (in July) so I'm having a bit of existential dread right now..",54,0
402,I keep feeling like I’m going to accidentally send a nude to someone or post nudes on social media,23,gpj8zt,https://www.reddit.com/r/OCD/comments/gpj8zt/i_keep_feeling_like_im_going_to_accidentally_send/,4,1590293866.0,...and I don’t even really take nudes lmfao. Bruh why OCD gotta be like this. I keep checking my social media and texts and closing out apps over and over..hahaha im just going to keep laughing at my suffering because it’s so ridiculous and illogical 🤣 and im tired of it,23,0
403,Here are the 3 differences between thoughts people with and without OCD have,36,gpkkis,https://www.reddit.com/r/OCD/comments/gpkkis/here_are_the_3_differences_between_thoughts/,2,1590300199.0,"
Difference 1- Misinterpreting and Trying to Control Obsessions

Research tells us that OCD also makes people think they have to try to control unwanted obsessional thoughts.

Difference 2: Research tells us that OCD often makes people overestimate the risk of bad things happening.

Research also tells us that OCD often makes people overestimate their responsibility for bad things happening.

Difference 3 - Aiming for Certainty and Perfection Research tells us that OCD leads people to struggle with and be distressed by uncertainty Research tells us that OCD leads people to struggle with and be uncomfortable when things are not ‘perfect’ or ‘just right’ – even if it is an impossible standard to achieve.",36,0
404,Yo what's up,20,gpktw2,https://i.redd.it/hairasvhpn051.png,2,1590301557.0,,20,0
405,Anyone else not able to watch or listen to things that they did when having a really bad relapse?,10,gpm951,https://www.reddit.com/r/OCD/comments/gpm951/anyone_else_not_able_to_watch_or_listen_to_things/,5,1590309487.0,Tried watching this youtuber who I was watching a lot when going through a bad phase with a lot of anxiety and even though I enjoy the content it reminded me too much of the time which triggered some anxiety. It’s a bummer.,10,0
406,Cancel culture,10,gpo6zf,https://www.reddit.com/r/OCD/comments/gpo6zf/cancel_culture/,3,1590319930.0,[deleted],10,0
407,Well...this exists,678,gpr1sm,https://i.redd.it/hzdwptl79q051.jpg,137,1590332400.0,,678,0
408,AMA I overcame Pure-OCD on my own years ago. Want to give advice out to those struggling with Pure-OCD.,12,gpr6f8,https://www.reddit.com/r/OCD/comments/gpr6f8/ama_i_overcame_pureocd_on_my_own_years_ago_want/,6,1590332808.0,[deleted],12,0
409,Hi everyone! I started something called Letters from Lisa! I want to write letters to anyone and everyone who needs or wants one for any reason. I just want to spread some hope and encouragement during this time of uncertainty!,11,gprspo,http://www.lettersfromlisa.org,0,1590334923.0,,11,0
410,"sometimes i want to ask my parents for support in fighting my compulsions, but then i remember that they don’t understand how difficult it is (and how much energy it takes) for me to do exposure therapy :///",115,gpwnlr,https://i.redd.it/sb6nhcrpur051.jpg,13,1590351738.0,,115,0
411,Curious: does anyone else feel more emotionally sensitive than others?,10,gtr2l8,https://www.reddit.com/r/OCD/comments/gtr2l8/curious_does_anyone_else_feel_more_emotionally/,3,1590892500.0,"Title sounds broad - let me explain:

Does anyone else ever feel like they are more emotionally sensitive than average people? Or far more squeamish than the average person? 

Trying to understand the mind...at 4am...almost",10,0
412,"Do you feel like everyone is out to get you? Like they will tell your past mistakes, ruin you because of your past, find out stuff from your past and hate you? Because of this I just wish I could start over. I'm scared of being myself or letting people know who I am",21,gtu4d3,https://www.reddit.com/r/OCD/comments/gtu4d3/do_you_feel_like_everyone_is_out_to_get_you_like/,10,1590907104.0,I'm scared and can't trust people. It's so hard to live in this world with no one to trust and feeling like you should be hated eventhough you just want a good life.,21,0
413,"This is juat a song i like listening to when My ocd is bad, thought some of you might like it.",10,gtxoxg,https://www.reddit.com/r/OCD/comments/gtxoxg/this_is_juat_a_song_i_like_listening_to_when_my/,3,1590925521.0," Here Comes a Thought (feat. Estelle & AJ Michalka) 
https://open.spotify.com/track/1SJhYNxOZSItqrB6upWyE6?si=fqecabC0RXCRpc4mwblBwg",10,0
414,I called the police on my self,22,gtzkre,https://www.reddit.com/r/OCD/comments/gtzkre/i_called_the_police_on_my_self/,5,1590934072.0,[deleted],22,0
415,OCD starter pack (me with health anxiety/OCD checking symptoms),55,gtzvli,https://i.redd.it/6z80v93l04251.jpg,27,1590934844.0,,55,0
416,Going to die alone because of this fucking illness,13,gu2aex,https://www.reddit.com/r/OCD/comments/gu2aex/going_to_die_alone_because_of_this_fucking_illness/,5,1590943353.0,"Going to die alone. Not because I'm ugly or worthless, but because I self-sabotage every potential relationship. Especially with this quarantine I can't tell what I'm not doing because it's actually unsafe and what I'm not doing because of intrusive thoughts. I KNEW this quarantine was going to fuck me up, it was just a matter of when. Doesn't help that my entire family has OCD so they're making me even MORE paranoid about everything. Every time I don't do something because of quarantine it doesn't matter if its justified it feels like i'm take a dozen steps backwards with my mental health. Does anyone else feel like this? I'm seriously having a really hard time with this.",13,0
417,Does the ‘or else something bad is going to happen’ thought/threat/feeling have a time limit for you?,24,gu2lq9,https://www.reddit.com/r/OCD/comments/gu2lq9/does_the_or_else_something_bad_is_going_to_happen/,2,1590944470.0,,24,0
418,Feeling weird,15,gu4byu,https://www.reddit.com/r/OCD/comments/gu4byu/feeling_weird/,5,1590950273.0,[deleted],15,0
419,I can’t find it !??,651,gu4r97,https://i.redd.it/4ywcj2hre5251.jpg,13,1590951718.0,,651,0
420,OCD is like living with super strict parents.,34,gu4u51,https://www.reddit.com/r/OCD/comments/gu4u51/ocd_is_like_living_with_super_strict_parents/,6,1590951972.0,"-too many rules

-ridiculous and unreasonable guidelines

-hard on you 

-make you think you’re not good enough

-keep you up at night

(Please add to my list in the comments if you want)",34,0
421,Scared of making long term friends or relationships because you fear them ruining your future or betraying you?,14,gu5f34,https://www.reddit.com/r/OCD/comments/gu5f34/scared_of_making_long_term_friends_or/,3,1590953953.0,I just want real life friends but it's so hard. I don't feel like I don't deserve friends either way but im so lonely,14,0
422,Living with OCD is a nightmare.,18,gu61vo,https://www.reddit.com/r/OCD/comments/gu61vo/living_with_ocd_is_a_nightmare/,0,1590956003.0,"I think it's one of the worst forms of anxiety and stress someone could have. 

It's stressed me so much that I have felt physically sick, many times my level of stress would be too much for me and almost had an heart attack or threw up. 

Many times my OCD was so hard to control that I almost lost my mind. 

In this last year I've managed to get it under control, more control than I ever had since I can remember having this illness. 

I still have the thoughts, I don't think they'll ever leave, but I'm under my own control now, most times, as I still feel like washing my hands or pressing buttons more times than I'm supposed to. I still have some of my other thoughts but they're not things I need to do ever again. 

I feel happy knowing this, I have started to notice now how lucky I am that my OCD seems to have almost completely disappeared. 

Thanks for reading. Bye. Good Luck.",18,0
423,I can’t do this again,12,gu6wlc,https://www.reddit.com/r/OCD/comments/gu6wlc/i_cant_do_this_again/,3,1590958839.0,"I’m a 16 year old girl and the last time I was this upset from my intrusive thoughts had to be a long time ago. 

Some backstory, I think I first started getting intrusive thoughts was 2 years ago shortly after I got my first period. I dunno if that’s related. The intrusive thoughts that hurt me the most were the vulgar imagery. They would involve animals and kids. I finally asked for help about a year later when I broke down after reading a comment on this subreddit actually. It was someone saying something like if you have thoughts like that about kids you’re messed up or whatever. Anyways I went to see a psychiatrist and I’ve been on 10mg lexapro for a while now. Had to switch psychs but I barely talked to either of them about the thoughts. Just wrote down my triggers on a piece of paper and gave it to the first one. I guess I never bothered to talk that much about it after that because they started to calm down a lot. And obviously I didn’t want to bring it up in the first place because it’s fucking humiliating and makes me feel guilty. I even saw a therapist for a bit but I stopped seeing her because I felt like I was “fine” and didn’t have much to talk about. I don’t know If all this is even necessary to put in this post and I feel like deleting it but I’ll just keep going. 

Flash forward to today I woke up and tried to go back to sleep but I kept getting the kid related intrusive imagery. I can’t go into detail. I tried to soothe myself and tell myself they’re irrational. But it didn’t work. So I started to cry and I remember thinking when the thoughts didn’t stop that all I wanted was to be asleep or sedated. I think I know why I might be getting them again. I started watching a show called Criminal Minds which is honestly really triggering sometimes but I became so attached to one of the characters that I don’t want to stop watching. I also forgot to take my lexapro last night. Which I don’t even know how much that effects my thoughts but idk it feels like I should mention it. I don’t know if any of this makes sense but I had to vent",12,0
424,Before vs after extensive OCD treatment :)),59,gu8l4c,https://i.redd.it/xgyyvktbh6251.jpg,2,1590964688.0,,59,0
425,Anyone else pick their lips? It was my first compulsion,11,gy3m2q,https://i.redd.it/7blvpysa8e351.jpg,10,1591494358.0,,11,0
426,Tfw you start to sense a past obsession about to repeat itself,25,gy3sgg,https://i.redd.it/b68behcaae351.png,3,1591495026.0,[deleted],25,0
427,Does anyone else compulsively delete things like social media accounts or pictures?,24,gy4zyz,https://www.reddit.com/r/OCD/comments/gy4zyz/does_anyone_else_compulsively_delete_things_like/,8,1591500135.0,I was just wondering if this was just a me thing or if it’s common.,24,0
428,Need help/Suggestions on boyfriend's OCD,10,gy5f7c,https://www.reddit.com/r/OCD/comments/gy5f7c/need_helpsuggestions_on_boyfriends_ocd/,9,1591502043.0,[deleted],10,0
429,Today I had a happy day.,46,gy64pq,https://www.reddit.com/r/OCD/comments/gy64pq/today_i_had_a_happy_day/,1,1591505409.0,"Today I genuinely felt happines, something that I hadn't felt in a while. I actually started smiling, not a fake smile, but a real one. 

I've had severe OCD since I was a kid, I'm now in my 20s. Living with OCD was really hard, it really hurt me many times. I felt sadness for most of my life.
But lately I've been far more in control of my OCD than I've been in years. 

I feel happy. 

I hope that everyone of you reading this can feel happines. I hope you can stop your OCD and take time to smile. 

😁✌️",46,0
430,"Washing Hands Before, During, and After Showering",12,gy8i6b,https://www.reddit.com/r/OCD/comments/gy8i6b/washing_hands_before_during_and_after_showering/,12,1591518180.0,"And even after all that, I still struggle to feel ""clean"" or ""safe."" This is a somewhat recent compulsion, and it's not even due to the pandemic. I just started doing it without realizing. Need help to stop.",12,0
431,Obsessing over being a good person,10,gy8w6h,https://www.reddit.com/r/OCD/comments/gy8w6h/obsessing_over_being_a_good_person/,21,1591520483.0,"I realized that i have been obsessing over being a good person.. I have been overthinking that am i good person? And i have been getting thesr thoughts where i hurted people with words, yeah i have done stuff like everyone else.. But yeah i remember these bad things and those make me feel bad
Anythibg i do, is either bad thing or not enough.. Or i dunno
I just want to relax but i feel like i had to watch myseöf closely so i wont hurt anyone.. I have been watchin videos about entiteld people and maybe intrusive thoughts comes ""That entiteld person is right"" And it just comes out of nowhere. And i grt anxious over it cause i dont wanna be shitty person 
I dont like myself.. And i hate myself, i just want to relax and be happy
Im maybe getting different kind of theraphy for my ocd",10,0
432,"Anyone have ""argumentative"" obsessions?",105,gy8zae,https://www.reddit.com/r/OCD/comments/gy8zae/anyone_have_argumentative_obsessions/,27,1591520973.0,"When I hear an illogical argument (e.g., the earth is flat) I obsessively construct counterarguments. I end up making variations of the same little ""speeches"" in my head dozens of time. It doesn't matter how airtight my counterarguments are, I am never ""finished"" with the ""debate."" I feel I have zero control over this mental process. It's exhausting, takes up hours, and  it's almost daily. Does anyone else ever feel compelled to do this? Am I the only one with this obsession?",105,0
433,Me responding to my irrational OCD thoughts,538,gyb26d,https://v.redd.it/b2kx8d0p9h351,16,1591531173.0,,538,0
434,I just wish OCD went away.,24,gyj96s,https://www.reddit.com/r/OCD/comments/gyj96s/i_just_wish_ocd_went_away/,14,1591560062.0,"Sometimes I feel I'm crazy. And nowadays I'm just so mentally tired. I just wished I could enter a fricking room without having to go in and out for half an hour, so I don't ""die"". I wished I could spend time with family and friends and just be happy. OCD has brought me so many problems. I am failing school because I can't concentrate on work because of intrusive thoughts, and I don't know how to tell my teachers that It's not really my fault and that sometimes I try very hard but sometimes it just seems impossible. I also can't hang out with friends like I used to before, not even on FaceTime. I frequently get into fights with other people because I am disrespectful or things like that when I am doing compulsions, and I just want to tell them I just don't want ""bad things to happen"". These days I just want to do absolutely nothing all day, because I've lost the ability to do basic things. OCD is sometimes making me develop depression, which just adds an extra wave of problems. 

I have gotten better tho. Before I used to shower for around an hour and used to bleed from showering too much. Now I shower for around 20 minutes and have a healthy skin again. I've stopped excessive hand washing and my hands feel soft again, after a pretty long time. And now I can see people without thinking I'm about to kill them.

But still, I don't feel nearly as happy as I used to, and sometimes I feel hopeless. And I wonder if I will live all my life like this. I'm not suicidal, but sometimes I just want everything to end. 

However, I recently told my parents that I want professional help. They don't know how bad I feel but I will start to go to therapy soon. I hope I will be able to live as I used to soon.

I'm sorry this is a pretty long post, but I just had to get everything off my chest. And thank you for whoever reads this.",24,0
435,"I wanted to share a poem I guess you could say, i wrote in hope it connects with somebody.",10,gyjdo1,https://www.reddit.com/r/OCD/comments/gyjdo1/i_wanted_to_share_a_poem_i_guess_you_could_say_i/,2,1591560433.0,"I am breathing but not living, A mind that was once optimistic and bright now littered with fear and intrusive fright, it imposes its will morning and night, nobody else sees in my eyes its a burden, so I hide all day even though I am hurting, when I lay my head to go away for the night I am certain it will be returning, for your mind knows how to torture and wont give in I accept the pain and torment, I am breathing but not living.",10,0
436,"Those who have been diagnosed, did you self diagnose beforehand or did the diagnosis come as a shock to you?",15,gykp37,https://www.reddit.com/r/OCD/comments/gykp37/those_who_have_been_diagnosed_did_you_self/,19,1591564385.0,[deleted],15,0
437,There is another!,2024,gyksy0,https://i.redd.it/m3gn31uj1k351.jpg,24,1591564726.0,,2024,0
438,After 2.5 months on Zoloft (Sertraline) 200 mg - Holy Shit! Is this how people without depression feel all the time?,178,h8m18t,https://www.reddit.com/r/OCD/comments/h8m18t/after_25_months_on_zoloft_sertraline_200_mg_holy/,90,1592103973.0,"I've severe to moderate OCD and GAD.I've been on Zoloft (Sertraline) 200 mg for 2.5 months now and experienced a lot of its attendant and not every enviable side effects (see my post history). But on the up side, I've started noticing that my mood is hell lotta better, I'm started consciously realizing with clarity the various aspects of my life and the possibility of improving/advancing on those dimensions - intimate relationships, career, friends and family, time outside of work, physical and mental health, etc.

I'm very extroverted and I've started having ppl over all the time (something I never did before). I've started working on cooking - one of my passions, and I send over everything from pies to black forest cake to my friends periodically. I often have ppl over at my place to try out whatever new dish I'm cooking that day. Most of my evenings my house becomes an open-house party with a constant stream of freinds, colleagues, acquaintances and family coming in and out.

For the first time in my life I've actually started noticing girls (I'm Male, 26) and have started hitting on girls (while staying the requisite 2 feet apart) and asked them if they'd be interested in a virtual coffee date on zoom. I'm way more interested now in checking up on how my friends are doing.

Did this happen to someone else after they started taking zoloft (sertraline) for a while? Only now did I realize that my ""default"" state always has been to be depressed/anxious most of the time and have a bad mood.

**EDIT: Sorry for my delay in getting back to you guys, it was (as you might've already guessed) because of the side effects of Zoloft (Sertraline) that I've been experiencing lol. Answers to some of the most common questions in the comments:**

**Q1: What about side effects? If yes, how are you coping with them?**

A: Hell yes! I've suffered from

* extreme fatigue/tiredness the whole day
* insomnia
* Nightmares (though I also got them from the sleeping pills that I took intermittently for short periods of time - clonazepam, trazodone and zopiclone), but they went away after I was on a stable dosage (200 mg) for like 2 months
* adverse sexual side effects (I can get an erection, but the sensitivity in my penis is drastically reduced, and orgasms are very muted and the pleasure is only around 10% of what it used to be)
* occasional (though not very frequent) moderate heartburns (though Tums and 2-3 hours makes it go away)
* little bit of nausea and diarrhea at the beginning (both of them have gone away)

The extreme tiredness and insomnia have more or less gone away 3 months after I reached a stable dosage (200 mg). Also, I was intermittently on clonazepam, trazodone and zopiclone for a few short periods to help with the insomnia. PS: clonazepam is super scary, be very careful with it.

The adverse sexual side effects haven't gone away or gotten better, and I'll be starting Wellbutrin soon to counter them. Praying it all works out. Fingers crossed.

**Q2: What happened to your intrusive thoughts, OCD triggers and compulsions?**

A: They still come, and they are still scary most of the time, but their intensity has kinda reduced, and I find it kinda easier not to give into them. Note that I also have an amazing therapist with whom I have been doing ERP long term which has significantly contributed to managing them.  


**Q3: How long did it take for you to start seeing the benefits?**

A:  It took me around 3 months after I reached a stable dosage (200 mg) for the benefits to start kicking in.",178,0
439,Love you guys ! 🥰,29,h8n76o,https://www.reddit.com/r/OCD/comments/h8n76o/love_you_guys/,3,1592108939.0,"I just want to say how unbelievably happy iam that I came across this form, it’s honesty such a comfort. It makes me feel like I’m not alone in this battle and reading everyone’s posts and seeing everyone supporting each other has pulled me out of some very bad spirals! Let’s stay supporting each other always! we can do this! and you are never alone 💕 we are like a little ocd family lol 😂🥰",29,0
440,ever thought of giving your OCD a name?,15,h8p90w,https://www.reddit.com/r/OCD/comments/h8p90w/ever_thought_of_giving_your_ocd_a_name/,2,1592119287.0,"i call him Carl, so everytime it starts bugging me i say in my head "" shut up Carl! , No one likes you Carl, God damn it Carl what did i tell you?! ""

and its helpful 😅

https://preview.redd.it/cvvzootiut451.jpg?width=400&format=pjpg&auto=webp&s=561b970596afab7a864d937436f81aa77b167004",15,0
441,I know a lot of straight people have OCD regarding their sexuality but do any other gay people experience this as well?,12,h8qckx,https://www.reddit.com/r/OCD/comments/h8qckx/i_know_a_lot_of_straight_people_have_ocd/,6,1592125242.0,[deleted],12,0
442,Today my dad told me OCD is not a mental illness,19,h8rp6a,https://www.reddit.com/r/OCD/comments/h8rp6a/today_my_dad_told_me_ocd_is_not_a_mental_illness/,6,1592131971.0,[deleted],19,0
443,Too true 😣,993,h8s1ft,https://i.redd.it/lf88bkdu0v451.jpg,20,1592133512.0,[deleted],993,0
