,title,score,id,url,comms_num,created,body,ups,downs
1141,What type of ocd do you have ?,57,nthuzi,https://www.reddit.com/r/OCD/comments/nthuzi/what_type_of_ocd_do_you_have/,78,1622971403.0,"What type of ocd do you have the most ?

[View Poll](https://www.reddit.com/poll/nthuzi)",57,0
1142,Do you sometimes forget what youu are anxious about or ruminate about?🙃,51,ntjf2g,https://www.reddit.com/r/OCD/comments/ntjf2g/do_you_sometimes_forget_what_youu_are_anxious/,6,1622977863.0,"You still anxiety but do not remember the exact thought that causes ypu the anxiety.

You think so much that you confuse and forget the trigger.

Can you relate?",51,0
1143,My mother died today,201,ntk354,https://www.reddit.com/r/OCD/comments/ntk354/my_mother_died_today/,27,1622980417.0,"I don't want to fish for condolences from strangers, however, i'd like to express my profound hatred towards my OCD. I fucking hate it with all hatred that still exists in this carcass of meat and bones. After a whole night of obssessing my relatives visited me bringing the dire news, and yet I can't even imagine her being in a better place now without intrusive thoughts and images swarming all over my head, those despicable critters that plague me day and night. I fucking detest it, what a cruel notion.

Please don't say 'my condolences' and the like, i don't like it and I don't want it. I will survive the loss somehow. And yet OCD won't go anywhere. That I don't think I can bear for much longer.

&#x200B;

Edit: Thank you for your words, fellow prisoners of flesh. I will manage, just to spite this illness aI will find some way.",201,0
1144,I'm looking for internet friends.,30,ntn88c,https://www.reddit.com/r/OCD/comments/ntn88c/im_looking_for_internet_friends/,21,1622990445.0,"I'm looking for internet friends.  Nice to meet you.  My name is ice (not my real name) Call me ice.  I am Japanese and live in Japan.  So my mother tongue is not English.  I'm sorry if I made a mistake because I translated it with Google Translate.  I'm really worried about OCD.  I look for things that I noticed, images, etc. for hours.  Because it doesn't get out of my head.  As I wrote in the previous post, I can't believe my own memory, so I'm wondering what to do if I do something bad or bad (mainly when I go out), maybe I'll die at night, tomorrow  I usually sleep in the morning because I'm so scared to sleep when I think about what to do if something goes wrong.  I would like to talk if there are people with the same symptoms.  Also, if anyone wants to talk about Japan, let's talk (this may not be related to illness, so I'm sorry if it's a violation of etiquette)

I've had a lot of hardships and wants to die.  This is because there are intellectual disabilities other than OCD.  But I didn't know it when I was a kid, so many people hated me and I was bullied lightly.  I'm very happy to have friends and best friends who understand me now, but sometimes it's very hard to remember the past.  Everyone has friends when they were students, but I don't have them now.  That's why I have a hole in my heart.  I'm sorry it's been long.  Some people are looking for friends here, so I posted it.  I'm sorry if anything makes everyone uncomfortable with this post.  I use Google Translate because English is not my mother tongue, but I would like to make friends on the internet.  Thank you very much for reading this far.",30,0
1145,Misophonia and OCD?,13,ntq4zn,https://www.reddit.com/r/OCD/comments/ntq4zn/misophonia_and_ocd/,15,1622998534.0,"Does anyone know what it is/have Misophonia? It’s another medical condition that often affects people with OCD. It’s basically where certain noises trigger you, often the sound of chewing or coughing, they’re common ones. The sounds make you angry or upset. 
I have it and it actually contributes to my OCD compulsions because when I hear a noise that triggers me I do certain rituals, that’s what I mean when I say they go hand in hand.",13,0
1146,I can't take it anymore. Need words of encouragement before I end things.,36,ntqqt1,https://www.reddit.com/r/OCD/comments/ntqqt1/i_cant_take_it_anymore_need_words_of/,25,1623000229.0,"TW suicid*, probably not a good idea to read if you are severely depressed. 

I've been drowning in my guilt and anxiety for the past three years and it's finally pulling me under. I have real-event OCD 
related to pocd (see previous post), and it won't go away. 


And I'm 22, but still living with my parents. 


And I had planned to start college this fall, but it's already June and I haven't applied anywhere yet.

I don't write anymore. 

I don't draw anymore.

 I don't do any activities that gave my joy in the past.


 Just constant anxiety, rumination, fear and guilt all day long.
And I avoid connecting with people in order to not be crushed when they discover my theme and think I'm some sort of weirdo. 

I give up. I'll never get better. I even started therapy (with a kind and caring OCD specialist), and medication, but they haven't helped shit so far. I'm exhausted.


My family would be devastated if I commit suicid*, and that hurts me to think about, but Its just so tempting to drive down to the desert, watch the sun set one last time, and as the light fades and the night sky fills with stars, quietly walk off a cliff, waiting to embrace death with open arms, and to return to mother earth where my pain will be no more.
 Apologize for the morbidity, but I'm struggling to find reasons to continue to struggle.  

Any response is hugely appreciated. And if anyone overcame something similar/ is going through something similar, I'd be down to chat if you're interested. 
Thanks


**Edit:** Just want to thank everyone who responded to this post and reached out. I'm not out of the woods yet, but you guys may have saved a life tonight. You are all great people. Thank you again from the bottom of my heart ❤️",36,0
1147,"FUCK YOU OCD, I'M NOT LETTING YOU DICTATE MY LIFE ANYMORE",22,nylipz,https://www.reddit.com/r/OCD/comments/nylipz/fuck_you_ocd_im_not_letting_you_dictate_my_life/,4,1623547045.0,[deleted],22,0
1148,I feel like my OCD aged me,112,nylx65,https://www.reddit.com/r/OCD/comments/nylx65/i_feel_like_my_ocd_aged_me/,17,1623548439.0,I look in the mirror and feel like I look a lot older and a lot more tired than what I should be. I’m still in my 20s but I just don’t feel youthful.,112,0
1149,Do your intrusive thoughts get worse when you’re tired or irritable?,18,nynqba,https://www.reddit.com/r/OCD/comments/nynqba/do_your_intrusive_thoughts_get_worse_when_youre/,7,1623554899.0,Feel like mine do,18,0
1150,My Pure-O OCD story and how I manage it,28,nyolj0,https://www.reddit.com/r/OCD/comments/nyolj0/my_pureo_ocd_story_and_how_i_manage_it/,12,1623558308.0,"Long story short, I had minor spells of OCD my whole life. Ranging from fear of vomiting as a kid to fearing HIV for months on end. Fast forward to the two month lockdown in Ontario and it took a whole new turn. I wrote an essay for a sociology class in April and hyperfixated on the word ""Oedipus Complex"". I then made the mistake of asking myself if it means I agree with Freud (despite being a full fledged homosexual) and it lead to incest OCD. For a month I completely dissociated from reality as I could only focus on this voice telling me ""you want to fuck your mom"". When I finally had a doctors appointment, he suggested I have OCD and everything changed. I studied the fuck out of it, and throughout the process developed other themes like POCD. Here is how I managed to get a grip

1. Everyone has intrusive thoughts, you can't control them, just your reaction
2. ERP (Exposure Response Therapy) is the only way out. Chase the thoughts. Visualize them. Let your anxiety spike as high as possible and eventually you will become desensitized. This can take time. Be patient.
3. You have to WANT to get better. Attitude and mindset is everything. It feeds of of fear and doubt. It's like a cancer, the more you feed it what it wants, the more it grows. 
4. Don't do your compulsion. Don't argue with the thought. Sarcastically agreeing with it sends the message that it was pointless. 
5. Don't dread the thoughts. Don't be scared of them. Welcome them. Consciously think about them and let it exist. Reminder: they can't hurt you - they aren't even real.
6. Self pity gets you no where. I realized this over time and can say that the more we wonder, ""why is this happening to me?"" or ""I just want to be normal"" it sends your brain the idea that you're scared of your OCD thoughts. You cannot feel sorry for yourself. You cannot fear anything. The more you fear the thoughts or wonder ""when will this end?"" - IT WONT. You have to stop feeling sorry for yourself and asking what you did to deserve this. 
7. Be your own best friend. Would you talk to yourself the same way you would your best friend? No. Be kind to yourself. Unconditional acceptance is so important.
8. Remind yourself that OCD is an anxiety disorder and not a terminal illness. It shows you're an empath. Good job :)
9. Don't seek reassurance. Ever. Deep down you know who you are. 
10. Consider CBT and medication if it becomes unbearable. I haven't done much CBT but have been prescribed 20mg of Citalopram and would recommend it.

There are many resources out there for people who can't access or afford therapy. Learning about mindfulness and the benefits of meditation have also really helped me. I'm going to link some Youtube videos that got me out of my rut and brought me back to reality. Some people I found very helpful are Katie d'Ath and Mark Freeman.

[https://www.youtube.com/watch?v=XjHzxzHnb1A](https://www.youtube.com/watch?v=XjHzxzHnb1A)

[https://www.youtube.com/watch?v=Gnm\_w4Wwtao&list=LL&index=21](https://www.youtube.com/watch?v=Gnm_w4Wwtao&list=LL&index=21)

[https://www.youtube.com/watch?v=vGOdnH6I3b8&list=LL&index=10](https://www.youtube.com/watch?v=vGOdnH6I3b8&list=LL&index=10)

[https://www.youtube.com/watch?v=UCs1\_laJjew&list=LL&index=4](https://www.youtube.com/watch?v=UCs1_laJjew&list=LL&index=4)

&#x200B;

Reminder: You've probably always had OCD. There have been good times and bad times. Embrace this part of you. It makes you who you are. There is hope!! Recovery stories exist, but the main goal is management. It may be something permanent but that's ok. It doesn't have to control you. Hope this helps!",28,0
1151,tiktok riddled with fear mongering,22,nyotmu,https://www.reddit.com/r/OCD/comments/nyotmu/tiktok_riddled_with_fear_mongering/,23,1623559173.0,im so tired of getting these conspiracy videos on my for you page. it is so triggering and it is what triggered my OCD in the first place in 3rd grade when all the 2012 bs came about. i dont feel real right now and i feel so scared. please be careful on there. people always fear monger “something bad is coming” like they have said that over and over and then people chime in and think they agree but it’s bullshit. im so tired of living in fear. i feel like im losing myself. im so tired of living on edge. most of those conspiracies have anti semitic propaganda roots too. i just need help and support right now i cant stop panicking. i just want to feel safe in the world. words of logic appreciated right now.,22,0
1152,I’m crying and it’s 3am,20,nyouy0,https://www.reddit.com/r/OCD/comments/nyouy0/im_crying_and_its_3am/,9,1623559307.0,"I’m lying down in my bed right now. Thoughts won’t stop coming. I was completely frozen/shaking for 10 minutes in an attempt to resist them...

Help me",20,0
1153,ocd worse during pms ?,56,nyp8y5,https://www.reddit.com/r/OCD/comments/nyp8y5/ocd_worse_during_pms/,26,1623560886.0,for those on here who experience periods~ does anyone else's ocd get significantly worse during pms? i'm 3 days out from starting my cycle and have been stuck in thought loops all day to the point that i basically stared at a wall for 2 hours earlier and then canceled plans to see friends because i was just too exhausted.,56,0
1154,Grey’s Anatomy,13,nyqbft,https://www.reddit.com/r/OCD/comments/nyqbft/greys_anatomy/,2,1623565522.0,[deleted],13,0
1155,Scared of religious ocd,14,nyuex3,https://www.reddit.com/r/OCD/comments/nyuex3/scared_of_religious_ocd/,3,1623584080.0,[deleted],14,0
1156,I can’t stop obsessing over stupid things I’ve done,52,nyuuua,https://www.reddit.com/r/OCD/comments/nyuuua/i_cant_stop_obsessing_over_stupid_things_ive_done/,12,1623585843.0,"All the embarrassing things I’ve done are like someone stabbing an ice pick into my brain over and over and over and I cannot stop thinking about how everybody knows I’m a fucking idiot because of it
I hate myself for these moments thinking about them makes me want to scream",52,0
1157,Resisted confession compulsions for an entire weekend,254,nyv7vz,https://www.reddit.com/r/OCD/comments/nyv7vz/resisted_confession_compulsions_for_an_entire/,30,1623587193.0,"Title says it all really. Saw my closest friends for the first time in 18 months (thanks Covid).  In that time I'd worked out what real event OCD was and worked on exposure and resisting confessions with my partner but I've recently come off my SSRIs and could feel the thoughts bubbling up at the prospect of seeing friends again. 

There were some tough spots but I feel simultaneously exhausted and invincible that I did it. OCD didn't win today.",254,0
1158,It’s so underrated because it’s not always obvious..,19,nyx6zh,https://www.reddit.com/r/OCD/comments/nyx6zh/its_so_underrated_because_its_not_always_obvious/,3,1623593585.0,[deleted],19,0
1159,Does anyone's OCD give them a feeling that they're going to act out one of your obsessions/harm someone? It's terrible.,19,nyxf2l,https://www.reddit.com/r/OCD/comments/nyxf2l/does_anyones_ocd_give_them_a_feeling_that_theyre/,9,1623594315.0,I'll get an awful feeling and I'll know what OCD is doing. It's giving me a false feeling that I'm going to reach out and harm someone.,19,0
1160,Does anyone else have ocd beating ocd?,14,nyyjwl,https://www.reddit.com/r/OCD/comments/nyyjwl/does_anyone_else_have_ocd_beating_ocd/,6,1623597569.0,I keep getting thoughts like “if I rub my head here the ocd will go away” or “bad posture is making my ocd worse” this shit is so ridiculous smh 😂😭,14,0
1161,Intrusive thoughts too severe that I'm planning on killing myself,11,nyzuee,https://www.reddit.com/r/OCD/comments/nyzuee/intrusive_thoughts_too_severe_that_im_planning_on/,10,1623601078.0,"So here I am, for the first time I'm gonna try to talk about my case in details so bear with me as I'm not a native speaker. 

I've always had OCD symptoms since childhood but never really thought they were problematic. They were basically simple compulsive tasks like trying not to step on the red part of the curb and other negligible actions until one night[late 2018] I started having these violent/gory images of people I hold dearly getting killed or tortured in gruesome ways. These aren't just thoughts or still images, they're like a nightmare, the only difference is that I can't wake up or shake them off...for example when I'm in class or with friends/family all external stimuli halts and my mind just focuses on whatever unwanted thoughts I'm having at the moment. 

They came outta nowhere. I haven't even watched a horror movie or played a gory game[although I used to watch/play those alot] that day. I thought they would stop by the time I fall asleep but they didn't. The next day they developed into sexual thoughts which were much worse than the violent stuff. I started having scenerios in my mind where I'm raping my 12 yo sister and having sex with my mother. You wouldn't imagine a fraction of the absolute misery I've felt every time I had those and this was the point where I started to think about killing myself, right from the next day. I spent hours upon hours googling for quick painless suicide methods and it frustrated me every time Google showed ""suicide prevention"" instead of what I typed. 

This torment would go on for a couple of weeks until it slowly dwindles to a level where I can no longer live in a constant distress but I would still require distraction like a phone or computer otherwise they come back. I dunno how and I can't explain it. It just stopped being that extreme. 

Fast forward 6 months of relative peace of mind and active social life the thoughts kicked off again conveniently when I was playing Resident Evil 4. I'll try to word how I felt, at the beginning I would have this dreadful feeling of realization in my stomach, I was ""oh shit! this can't be happening again"" I couldn't believe I'm about to go through all that mental torment again then once the thoughts begin they will never go. This time they redoubled in intensity to the point where I am feeling literal physical pain in my body. For example if I see my fingers getting crushed by a hammer then I'd feel the pain like I'm experiencing it. It kept getting worse, from worrying about how to get rid of the unwanted thoughts to how to deal with the pain. Other imagery I would have is my limbs getting sawed off, my balls getting crushed or slashed. These are the worst so far. This time they lasted for about two months and just like the previous time, the intensity decreased very slowly until they became in the background then completely forgot about them. 

Now they are back for the third fucking time. Few hours ago I had a flashback of how I was struggling through the intrusive thoughts and somehow they stuck and now I can't let go. I can't stop them, I can't concentrate on my studies/exams, I can't listen to my mom or sister, I can't even see their faces because I'm busy seeing them getting raped or ran over by a semi-truck. 

Before you tell me to welcome my thoughts in the hopes that I become desensitized, I tried and it didn't work. All of my attempts to stop them were fruitless including ERP which(with all due respect) I find to be absolute bullshit. I would spend two hours visualizing the thoughts without any results.

I'm posting this because I'm desperate and tired. I live in a third world country where mental health issues aren't taken seriously and the quality of psychiatry is pretty damn low. They just put us on medication until we collapse or simply laugh at us and tell us ""go out more"" and ""it's just a phase""(unironically). Even my mom my best friend told me to go back to God and start praying again. This is the worst situation that anyone can live. I really don't want to live like this for the rest of my life and I'm certainly not going to have another episode of this shit. I'll off myself before I go through it again. I think I'm gonna cry...",11,0
1162,Those darn thoughts.,35,nz08y6,https://www.reddit.com/r/OCD/comments/nz08y6/those_darn_thoughts/,15,1623602214.0,[deleted],35,0
1163,When it all started...,20,o3uujj,https://www.reddit.com/r/OCD/comments/o3uujj/when_it_all_started/,10,1624153458.0,"""One out of every five of you sitting in this room will be diagnosed with cancer in your lifetime."" That was a line from a motivational speaker that spoke at a school assembly when I was in fourth or fifth grade that kicked off my very first OCD theme. To be clear, it did not cause my OCD, it's genetic, but why in the hell would you say that to a room full of kids?

\*Flaring this as venting because I really don't know what else to mark it as, but I think funny or shitpost might fit better. It doesn't bother me anymore, just thought some of you might be able to relate.\*",20,0
1164,"DAE get ""lucid"" moments where their ocd disappears temporarily?",31,o3uw15,https://www.reddit.com/r/OCD/comments/o3uw15/dae_get_lucid_moments_where_their_ocd_disappears/,11,1624153618.0,"Occasionally I'll go for like a 30 minute period where it's like I'm back to my old self and I don't feel the urge to do any compulsions and think all the intrusive thoughts I were just having are ridiculous. Then the ocd will come back like a freight train lmao. Can anyone relate?

Edit: I'm having one right now. OCD pretty much gone and I'm so happy.

Edit 2: OCD back in full force lmao",31,0
1165,I know that OCD is a liar yet i keep listening to it,14,o3w3da,https://www.reddit.com/r/OCD/comments/o3w3da/i_know_that_ocd_is_a_liar_yet_i_keep_listening_to/,6,1624158057.0,When i resist doing my compulsions my brain kinda starts negotiating with me and i think oh i will just do this one compulsion but after that no more and then after i end up relapsing and doing compulsions for hours on end.,14,0
1166,this illness ruined my life,13,o3wrq5,https://www.reddit.com/r/OCD/comments/o3wrq5/this_illness_ruined_my_life/,17,1624160457.0,[deleted],13,0
1167,"Thank you for being such a helpful and wholesome community. (I'm the guy with the stove from yesterday, who cooked for the first time since years. Food pic inside!)",262,o3wvxn,https://www.reddit.com/r/OCD/comments/o3wvxn/thank_you_for_being_such_a_helpful_and_wholesome/,31,1624160853.0,"Yesterday I asked you to wish me luck in a big step in combating my OCD, and I was overwhelmed and even a little teary-eyed by all the support. 
The original post: https://www.reddit.com/r/OCD/comments/o34bll/im_going_to_cook_myself_a_meal_using_the_stove/

When it came to the point where I usually do my compulsion, I thought of all of you who believed in me and I actually pulled through. That was awesome. Thank you a lot!


http://imgur.com/a/HSz7VvE",262,0
1168,Live with uncertainty! Live with uncertainty! Live with uncertainty! Live with uncertainty!,39,o3xqez,https://www.reddit.com/r/OCD/comments/o3xqez/live_with_uncertainty_live_with_uncertainty_live/,11,1624164036.0,"Learn to live with uncertainty. Accept that you will never be 100% sure about what will happen. Dethrone security.

Most likely, nothing will ever happen. Just as it has likely never happened in the past, it won't happen now either. If anything does happen, you'll be able to deal with it, because we are stronger than our fears. But you have a mental condition. The same one that millions around the world have, with the same symptoms, and the same worries. So, It's wayyyy more likely that what you're fearing is just ocd exaggerating stuff, as it always has done and always will do.",39,0
1169,I’m literally a fucking slave to my own brain,19,o3yim2,https://www.reddit.com/r/OCD/comments/o3yim2/im_literally_a_fucking_slave_to_my_own_brain/,1,1624167284.0,"I hate this fucking stupid bullshit 

All I do is complain because I know damn well shit won’t fucking change. I feel like all I do is wash my goddamn mother FUCKING hands twenty four seven. 

Hmm I washed for thirty seconds instead of forty, whoops gotta wash again 

Oh no I may have touched the faucet even though my fucking hand is literally suspended in the air 5 fucking feet from the sink to avoid touching it in the first place.


Again and again and again and again and again and again and again and again and again and again and again and again and again and again and again and again Again and again and again and again and again and again and again and again and again and again and again and again Again and again and again and again and again and again and again and again and again and again and again and again Again and again and again and again and again and again and again and again and again and again and again and again Again and again and again and again and again and again and again and again and again and again and again and again Again and again and again and again and again and again and again and again and again and again and again and again Again and again and again and again and again and again and again and again and again and again and again and again Again and again and again and again and again and again and again and again and again and again and again and again Again and again and again and again and again and again and again and again and again and again and again and again Again and again and again and again and again and again and again and again and again and again and again and again Again and again and again and again and again and again and again and again and again and again and again and again 

ALL FUCKING DAY ALL FUCKING NIGHT 

my normal time to sleep is around 2-3 am because I’m up washing my fucking hands or procrastinating washing my fucking hands. Either way I lose.


I hate touching trash and poop, but guess what I have to do? 


TOUCH TRASH AND SIT MY FUCKING ASS ON THE TOILET AND SHIT CONSTANTLY, AND IF A TRASH BAG TOUCHES MY PANTS OR MY CLOTHES I FEEL UNCLEAN 


Sitting in this fucking house the only part of it that feels somewhat clean is my fucking room. Even my fucking room doesn’t feel clean. My own FUCKING ROOM DOES NOT FEEL CLEAN. THE PLACE WHERE I REST MY FUCKING HEAD (past 2-3 am) does not feel clean to me.


I walk around this fucking house with my hands clasped together “👏🏽” looking like a fucking monk because I can’t touch fucking doorknobs or light switches. I wouldn’t be surprised if I forgot how to walk normally.


I HAVE TO SHOWER FOR AN HOUR EVERY FUCKING DAY BECAUSE MY ASS FEELS UNCLEAN EVEN THOUGH I LITERALLY SHOVE THE FUCKING WASH CLOTH INTO MY ANAL CAVITY EVERY FUCKING DAY EVEN AFTER USING A WHOLE FUCKING TOILET PAPER ROLL TO WHIPE MY FUCKING ASS 


IM SO FUCKING EXHAUSTED AND FED UP IM TIRED OF THIS SHIT.

The only thing keeping me from destroying this house and breaking shit is that it’s not my house, it’s my dad’s. 


I have not had a proper mental breakdown yet, as I’m considerate of other’s peace. So I’ve basically been surprising my absolute rage and hate for my mental state for a year.


Listen to me 

Listen to what the fuck I’m telling you right now

I’m fucking 


E
X
H
A
U
S
T
E
D.",19,0
