,title,score,id,url,comms_num,created,body,ups,downs
819,None of it is real. Never has been. Never will be.,505,kphkoh,https://www.reddit.com/r/OCD/comments/kphkoh/none_of_it_is_real_never_has_been_never_will_be/,56,1609665404.0,"It’s all fake. All of it is false. Every negative thought, every intrusive thought, every panic every fear every anxiety every doubt every confusion every “genuine” feeling. No matter how real it’s not. All of it is fake. All of it is false. All of it. None of it is real. You have to tell and remind yourself that. No matter what. All of it is fake. None of it is real. none of the feelings are. None of it. Will always feel real and convincing just know that it isn’t. No matter what. Remind yourself. None of it is real. None of it. Tell yourself every day. Get to this point by breaking yourself out the loop. 

I’ve learned that whether or not we believe or are aware of it negative thoughts do have power and we attract what we fear by compulsively focusing on it. Danger is always real but fear is always a choice. We can’t control what happens in life or in the future, it’s part of where fear stems from. But we can control how we react to them. Acceptance is the root of healing. Accept what you fear may happen but also may not. Accept what you fear did happen and accept that you can’t change the past. Accept that you have no control over what you don’t know and learn to let go. It is possible as impossible as it seems and I am proof of that. Once I got healthier this post helps me stay that way by reminding me not to fall back into old habits that served me no purpose but pain and fear.",505,0
820,People don't understand.,137,kpixig,https://www.reddit.com/r/OCD/comments/kpixig/people_dont_understand/,39,1609672495.0,"People fucking don't understand what the fuck it feels like waking up every fucking morning and living their life in a constant panic attack mode. I literally am forcing myself to breathe trough the day, its a whole ass activity. I just want all of this to end. I want some fucking peace. And that burning, that feels like your skin is poked by 1000 needles, i neee a fucking break.",137,0
821,We cannot stop our intrusive thoughts. We can however control how we react to them.,132,kpl7wl,https://i.redd.it/j7bvuz6lk4961.png,39,1609683039.0,,132,0
822,OCD causing you to fall back on work/school:,53,kpncg8,https://i.redd.it/0hgxud2s75961.jpg,7,1609690836.0,[deleted],53,0
823,ocd and reading?,53,kpoipw,https://www.reddit.com/r/OCD/comments/kpoipw/ocd_and_reading/,25,1609694598.0,"i was one of those kids who would read constantly, devour ten books in a week and still want more. i loved it more than anything. i still do. but my ocd makes it so difficult for me to read. as i’ve gotten older and it’s gotten worse, i find myself re-reading the same line or page over and over again until it “feels right”. sometimes i force myself to move on but then i come right back to it. i don’t know why, i just feel that i want to “understand” or “absorb” the words, whatever that means, and that often means re-reading until the words mean nothing.

of all the things my ocd has taken from me, i think this has been the worst. i still read every day, as much as i can, but even 30 pages is a success sometimes. it feels like a battle just to get through a book, but i do it, because for those pages where i don’t have to re-read, where things flow and spin around me, everything else disappears.",53,0
824,We got this!,820,kpokze,https://i.redd.it/2665621jj5961.jpg,19,1609694787.0,,820,0
825,A letter to myself & you,23,kpox1x,https://www.reddit.com/r/OCD/comments/kpox1x/a_letter_to_myself_you/,5,1609695828.0,"I had a really rough day yesterday. Spent over 9 hours googling (this is my compulsion) from a place of deep fear. (I have health OCD and tend to google every single intrusive thought and seek reassurance from reddit forums, etc regarding whatever I’m afraid of) This morning I woke up feeling hungover- mostly just feeling a lot of shame. I was journaling a little and wrote myself a letter of what I might say to a friend who came to me in this situation. I wanted to type it out in case you need to read this today: 

“Dear one, 
All the things you’re feeling are valid. First of all, it’s okay to be feeling scared. That fear is not silly or stupid. It is valid. Second, there’s no shame in how much time you spent on the internet yesterday. Remember that you have a mental illness. Do you feel shame for trying new ways of relieving your pain when you’re sick with a cold? No. You were looking for comfort, and you can see today in the light of a new day, that those things didn’t work. There is no shame in that. 

You are a human looking for ways to come back to yourself while feeling lost and overwhelmed with fear. Today you are coming back home to yourself. There is no shame. Welcome home.”",23,0
826,Does anyone else experience a worsening of symptoms when the sun starts the set?,32,ku4pg5,https://www.reddit.com/r/OCD/comments/ku4pg5/does_anyone_else_experience_a_worsening_of/,10,1610243363.0,"For as long as I can remember my symptoms always seem to start getting really bad when the sun goes down. Even if I’m out with friends, not home, focusing on something else, etc. It isn’t just a “I’m laying in bed alone with my thoughts” type thing. As soon as it starts to get dark outside that anxious nauseous feeling sets in and the obsessive thoughts become almost unbearable. Anyone else?",32,0
827,Anybody else ever get into moods feeling kind of needy or even just sappy/sensitive?,20,ku5pl0,https://www.reddit.com/r/OCD/comments/ku5pl0/anybody_else_ever_get_into_moods_feeling_kind_of/,4,1610246836.0,I don't get this all the time but rather occasionally. There's this weird need to either support and help someone else (and be appreciated?) Or sometimes vice versa. During this time I'm dm sensitive to seemingly minor things.. I've as of this week just gotten out of slump. There are other times where I I'm extremely confident and on top of everything and could care less and need not. I've often referred to them as confidence flares.. Anybody get this weird crap?,20,0
828,"I feel like this is one of the most active subs because people are constantly seeking reassurance, lol",26,ku6eu9,https://www.reddit.com/r/OCD/comments/ku6eu9/i_feel_like_this_is_one_of_the_most_active_subs/,2,1610249343.0,"I think this may be one of the most active subs in terms of posting rates, but least active in terms of commenting/responding.

Because on the one hand the posters are constantly seeking reassurance, and on the other hand, the people who see the posts (others with OCD) know that reassuring people won’t help 🙂 so they don’t respond lol. Just a theory",26,0
829,Anyone know if this stuff works for OCD? 😆 You gotta laugh about it sometimes!,15,ku6trp,https://i.redd.it/4unw9v12hfa61.jpg,8,1610250877.0,,15,0
830,I know my thoughts make no sense.,1434,ku977d,https://i.redd.it/qamjn7eh8ga61.jpg,20,1610260096.0,,1434,0
831,When your hand sanitizer u use obsessively to feel safe has the same number of fluid ounces as The Good Number,30,kuhf4q,https://i.redd.it/cxkn9kjs6ja61.jpg,2,1610295848.0,,30,0
832,"With #ocd, this is incredibly difficult.",19,kuhm43,https://i.redd.it/5miqervh8ja61.png,3,1610296423.0,,19,0
833,Does anyone else's OCD specifically target the things in life that might make you happy?,71,kui66l,https://www.reddit.com/r/OCD/comments/kui66l/does_anyone_elses_ocd_specifically_target_the/,18,1610298140.0,"I've noticed this with my situation. For example, I don't care as much about contaminating things in the kitchen, but I freak out over contaminating my computer or anything gaming-related. I think this is because my OCD is based on self-hatred and punishment.",71,0
834,"I feel like when people say ""everyone makes mistakes, what matters is that you learn from them"" it doesn't apply to me",18,kuisih,https://www.reddit.com/r/OCD/comments/kuisih/i_feel_like_when_people_say_everyone_makes/,4,1610300016.0,"I've done some truly horrendous things, i feel like calling what I did a mistake is just downplaying what actually happened, I feel like I deserve to be feeling shitty about it.",18,0
835,I used to think exposure in ocd meant facing my fear at its highest point...over the years I've learned there are many ways to get exposure without doing this. https://youtu.be/W_zE84OufwE,46,kywpo4,https://i.redd.it/huua7dvvtsb61.png,3,1610848426.0,,46,0
836,how do you seek help for ocd when you are too afraid to tell someone your intrusive thoughts?,10,kywxqp,https://www.reddit.com/r/OCD/comments/kywxqp/how_do_you_seek_help_for_ocd_when_you_are_too/,6,1610849178.0,[deleted],10,0
837,Racism OCD.....motherfucker,15,kyy3ak,https://www.reddit.com/r/OCD/comments/kyy3ak/racism_ocdmotherfucker/,2,1610853181.0,[deleted],15,0
838,OCD is the worst thing that has ever happened to me.,30,kyzkz5,https://www.reddit.com/r/OCD/comments/kyzkz5/ocd_is_the_worst_thing_that_has_ever_happened_to/,18,1610858564.0,"Even if I were to take all of the worst, most painful things that have ever happened in my life and put them in a pile, none of it compares to the pain OCD has brought me. I’d rather have literally any other mental illness, any illness at all, than this. The worst part is that no one in my life even knows I have OCD. The intrusive thoughts have made me incredibly suicidal at times, and I always thought that if I were to go through with it no one in my life would even know why. 

I think I’m getting to the point where I want to try to talk to someone about it but I just don’t know how.",30,0
839,"this is how ridiculous our thoughts are, we always think that when we see another OCD case, but we think ours is different, no, it’s also ridiculous",1564,kz3302,https://i.redd.it/pj2cl2lqxub61.jpg,49,1610873934.0,,1564,0
840,"Being a Muslim with OCD is kinda tough during Ramadan(fasting month) I mostly avoid people or doing any work near water, steam. Im really paranoid and my parents are worried. This year it’s going to be during the start of my first semester. And i want to live peacefully.",16,kz3f25,https://www.reddit.com/r/OCD/comments/kz3f25/being_a_muslim_with_ocd_is_kinda_tough_during/,12,1610875667.0,[deleted],16,0
841,"does anyone else get triggered by people who are the thing related to your obsession?? for example, for health anxiety, i would get triggered when i saw a video of someone with a disease",24,kz83lh,https://www.reddit.com/r/OCD/comments/kz83lh/does_anyone_else_get_triggered_by_people_who_are/,6,1610896466.0,,24,0
842,I hate OCD,10,kz8ob3,https://www.reddit.com/r/OCD/comments/kz8ob3/i_hate_ocd/,2,1610898381.0,[deleted],10,0
843,OCD reminder: compulsions,87,kz91rs,https://i.redd.it/8r24149z1xb61.jpg,10,1610899574.0,[deleted],87,0
844,Was on the verge of suicide today.,18,kzaz2w,https://www.reddit.com/r/OCD/comments/kzaz2w/was_on_the_verge_of_suicide_today/,7,1610905512.0,[deleted],18,0
845,Simple Mindfulness Meditation for OCD,17,l3pvjd,https://www.reddit.com/r/OCD/comments/l3pvjd/simple_mindfulness_meditation_for_ocd/,2,1611453128.0,[deleted],17,0
846,I spend too much time writing everything down,13,l3qxf5,https://www.reddit.com/r/OCD/comments/l3qxf5/i_spend_too_much_time_writing_everything_down/,18,1611456911.0,"Is this a compulsion? My notes app is ridiculous. Nearly every thought I have, I feel like I have to write it down. I think this comes from two things: a fear of forgetting (I have ADHD so thoughts escape me very quickly, and I worry if I don’t write them down I’ll lose important ones forever) and a desire to “declutter my brain.” I often feel like my thoughts are knocking around and tangling in each other in my head, and unless I write them down (even sometimes after I write them down) they will nag me and feel like loose ends I need to tend to. Constantly taking notes is my way of trying to rid myself of excessive/repetitive thoughts and find some peace in my mind. I can’t really rest until I’ve done it. And I find myself writing a lot of the same things down repetitively. 

Does anyone else experience this? I haven’t been diagnosed with OCD but have been recently thinking I might need to talk to a psychiatrist about it (not just because of this note thing, but lots of other things too.)",13,0
847,"Anybody else ever having fun with friends and then OCD is like......hey wyd....what if you obsessed about “X,Y,Z” FUCKING EXHAUSTING",25,l3s97j,https://www.reddit.com/r/OCD/comments/l3s97j/anybody_else_ever_having_fun_with_friends_and/,9,1611461820.0,[deleted],25,0
848,Being brave and facing a fear by posting,60,l3sr3c,https://www.reddit.com/r/OCD/comments/l3sr3c/being_brave_and_facing_a_fear_by_posting/,14,1611463805.0,My OCD tells me the world will figure out who I am from my Reddit account and then I will be shamed and my work life will be ruined. And I will somehow get fired. But today I’m telling my OCD to suck it and posting here. Because I want to be there for others with my condition and I want support. Let’s kick OCDs butt together!,60,0
849,It’s like playing whack a mole,17,l3t0ai,https://www.reddit.com/r/OCD/comments/l3t0ai/its_like_playing_whack_a_mole/,4,1611464759.0,"I do the exposure, I manage to overcome a compulsion and then all of a sudden new ones have popped up. Or worse an old compulsion makes a sudden reappearance. 

I’m just tired and it feels like no matter what I do I’m not making lasting improvement",17,0
850,"Someone replied to this and said ""no ocd is wanting to be perfect like counting 30 times or washing hands"" and it pissed me off so much people are so uneducated.",88,l3t7xa,https://i.redd.it/auc7zit4t7d61.png,7,1611465624.0,,88,0
851,I wish i could just freeze my body or put myself into a coma,20,l3v4d5,https://www.reddit.com/r/OCD/comments/l3v4d5/i_wish_i_could_just_freeze_my_body_or_put_myself/,11,1611474172.0,"Until they figure out how to treat this fucking disorder properly. I haven’t done nothing else today, than sit on my ass, eat, make tea, brush my teeth, and waste time on internet and i’m exhausted. Everything i do is a chore that takes time.

Just  brushing my teeth takes 30 min. 5 min is closing the fucking toothpaste can, 10 to 15 min washing my hands, few min actually brushing my teeth and rinsing with water, and then closing and opening and closing and opening the fucking faucet. And this is just brushing my teeth...rest mandatory stuff i do is not any easier, all my wake time goes on dealing with this fucking nightmare. If i used alcohol, i would treat myself with that for sure and be an alcoholic by now.

Getting tired with OCD is so fun, because no matter how tired you are you never get a break, if it affects everything you do.",20,0
852,"Pure O is ruining my life. Here's its cycle: 1. tell me a false story of something I ""did,"" 2. paralyze me with fear, 3. make me sink into crappy reality TV shows for hours at a time so that I can attempt an escape",21,l3wxot,https://www.reddit.com/r/OCD/comments/l3wxot/pure_o_is_ruining_my_life_heres_its_cycle_1_tell/,5,1611483554.0,"It's debilitating. It's been a tough year for many, me included, but I just moved into a new apartment in a new city, and the idea of a fresh start has given me enough energy and hope to push past the intrusive thoughts for a (record breaking!) two weeks. 

But then I woke up in the middle of the night and convinced myself that I did something horrible. It's so horrible that I don't want to say it, but I'm sure that people on this sub can imagine the caliber of horror when it comes to the lies that OCD tells us. Anyway, I started trying to reassure myself and managed to go back to sleep. But now I've been awake for four hours and have gotten nothing from my to-do list done. Instead, I've sunk deep into a rabbit hole of crappy reality TV shows and their subreddits. When my productivity app would tell me I'd been on reddit for too long, I'd snooze it because it just felt like a reminder that I can't escape/disbelieve the intrusions unless I'm immersed in my phone.

I just want to leave all this behind. I'm not formally employed, and my income depends directly on how much work I get done. I haven't made money in a very long time. I have to unpack my apartment. I have to be a better, more reliable partner. There are so many things I need to do. But my constant need to convince myself that I didn't commit a horrible crime is stopping me from doing anything. Reading about the petty drama from the cast of shows like Teen Mom is the only thing that helps me. Why can't getting my work done, exercising, or doing necessary chores help me? Any sense of ""accomplishment"" those things give me makes me think, ""I don't deserve to feel this way. REMEMBER THAT HORRIBLE THING I DID!?""

I'm just so sick of this.",21,0
853,Anyone else??,505,l40g7h,https://i.redd.it/838a3kl5jad61.png,80,1611498591.0,,505,0
854,the worst part about having intrusive thoughts about someone you’re very close too you is that you can’t even talk to them about it,46,l40h7h,https://www.reddit.com/r/OCD/comments/l40h7h/the_worst_part_about_having_intrusive_thoughts/,6,1611498687.0,,46,0
855,Moral Scrupulosity/ real event OCD,10,l40jga,https://www.reddit.com/r/OCD/comments/l40jga/moral_scrupulosity_real_event_ocd/,0,1611498911.0,[deleted],10,0
856,Be Aware,20,l4195g,https://www.reddit.com/r/OCD/comments/l4195g/be_aware/,1,1611501609.0,"I had OCD for the past 14 years. I didn’t know it was OCD until a year ago. I wasted a lot of time in the thoughts. Time that will not come back. This are tips that I have gathered from my experience, they might work for you they might don’t. If they dont work, feel free to reach out to me. I understand you, I know the pain. I went to all of my school years with this shit in my brain. I’m no psicologist but I know very well the pain. Well this are the tips:

All the thoughts and sensations are happening inside our heads. We have to be clear of this. I recommend to you all to write the thoughts down in a piece of blank paper and burn it.

We don’t have special powers that predict what is going to happen in the future or that we can change the future. Our brains believe we do. One cannot know the future with 100% probability. Your thoughts might happen but don’t associate the fact that they happen because you didn’t do the compulsions because that’s just a lie your brain tells you. Remember that your brain is torturing you and will keep going on and on for an excuse for you to continue doing the compulsions.

Don’t search for the right moment to stop having the thoughts. If you are reading this, fetch the paper right away and burn the thoughts away. You shouldn’t trust all that your brain says. Your brain is trying to torture you. Be aware of the present moment every time you can, try mindfulness meditation.

Be aware that you can control what you think. Look at the floor for a second, and then close your eyes and think only of the floor. You can. Be very mindful of this.identify the instrusive thoughts and tell them to fuck themselves, don’t turn this into a compulsion. If it’s already turning into a compulsion. Breath in and out and relax.

Relax, just relax. You don’t actually have to do anything your intrusive thoughts say. You just have to relax and do what you like.

OCD tends to make you feel that all things you do are meaningless; they are not. Enjoy your life. Enjoy the time you have. Write what you did in the day. Be mindful that your life is passing away every single second.Start to enjoy life

A very positive thing of having OCD is that when you finally are aware that all the thoughts are happening inside your head and you can actually relax. All thing in life become a lot more easier. We have that advantage that other people don’t have. We actually suffered every single day with anxiety or stress, when we don’t we enjoy it a lot more.

Be aware that your mind is sick. Don’t trust every single thing it says. Relax and identify the compulsions and intrusive thoughts and sensations. Relax, this is the most important of all, relax. You don’t have to feel anxiety, stress and pain every day of your life. Just relax.Have a nice day.",20,0
857,social media ocd ?,38,l42u5n,https://www.reddit.com/r/OCD/comments/l42u5n/social_media_ocd/,12,1611506595.0,i was just wondering if anyone else does this but before i’m going to be away from my phone for a long period of time (sleep/college/work etc) i have to go onto all of my social media’s and refresh my profile and feed over and over again until i’m 100% certain i haven’t accidentally posted anything and if when i’m closing the app my finger doesn’t press the home button exactly in the middle i feel i’ve just accidentally posted something and i have to do it all over until it feels right again. it’s so annoying when i just want to sleep because it takes so long.,38,0
858,i cant take it anymore,10,l43jux,https://www.reddit.com/r/OCD/comments/l43jux/i_cant_take_it_anymore/,3,1611508747.0,i have been struggling with ocd for as long as i can remember. it’s gotten to the point where i cant write anymore. and the intrusive thoughts. i hate myself so much because of it. really i can’t do this anymore,10,0
859,"I hate how when I’m watching TV and the volume is on 12 it’s too quiet, and 14 is too loud, but 13 is perfect but it’s a bad luck number so I can’t ever put the volume on 13 :/",80,l469ug,https://www.reddit.com/r/OCD/comments/l469ug/i_hate_how_when_im_watching_tv_and_the_volume_is/,16,1611517872.0,[deleted],80,0
860,Do you trust yourself?,20,l47c5g,https://www.reddit.com/r/OCD/comments/l47c5g/do_you_trust_yourself/,12,1611521617.0,Or have you lost sense of who you even are like me lol,20,0
861,"For you, the reader, don’t let your ocd tell you this isn’t for you, it’s for you.",56,l91a90,https://www.reddit.com/r/OCD/comments/l91a90/for_you_the_reader_dont_let_your_ocd_tell_you/,5,1612056913.0,"You reading this, I know you’re feeling scared right now,
Feeling Guilty maybe
Like you are disappointment or something, this is how I’ve felt recently 

But you know it passes, and when it passes again you will be even stronger than you are now 

Feelings don’t define you 
Intrusive thoughts are painful, and yet you still go to work, you still smile, you still keep moving forward.
You are so strong and I want you to believe that.

Don’t beat yourself up for checking, I know it isn’t ideal for recovery, but hey don’t judge yourself for your compulsions okay 

Set productive goals that you resonate with 

There is no rush, you are a strong soul and mean the world to someone",56,0
862,Me checking the comment section every 5 minutes for a comment I never left.,94,l91hv4,https://i.redd.it/y78y1jyapke61.jpg,2,1612057573.0,,94,0
863,Am I the only who’s scared to tell my compulsions?,13,l9257k,https://www.reddit.com/r/OCD/comments/l9257k/am_i_the_only_whos_scared_to_tell_my_compulsions/,11,1612059658.0,"I’m kind of scared telling others about my compulsions, because what if they said, “that is how people who is in denial thinks like.” Do you feel this too?",13,0
864,I regret telling the therapist and I feel like my life is over,18,l93fqp,https://www.reddit.com/r/OCD/comments/l93fqp/i_regret_telling_the_therapist_and_i_feel_like_my/,8,1612063829.0,"Hi I’ve been struggling with intrusive thoughts for years. I have severe OCD which manifests with the worst themes imaginable.(21F)

Recently I went through something traumatic and it was like something snapped inside me. My OCD went haywire and the thoughts now come in non-stop. I started going to therapy and in the second session I broke down and told the psychologist about the content of these thoughts. 

Her reaction was good and it gave me temporary relief. At first she asked me questions about whether I’ve ever acted on these thoughts and I said no. She then assured me that I am not what I think I am and gave me advice on how to deal with the thoughts. 

But now I’m panicking. I feel like I’ve now exposed myself. I’m wondering whether one day this information could be leaked although she has assured me that she has no right to share it with a third party unless she believes I may harm myself or someone else. What if she secretly thinks I may harm someone? 

She has a personal and private iPad where she writes notes which she says that no one ever sees. They are just for her own memory. But I’m scared there’s a secret mental health file where everything I’ve said is being recorded. Or what if I can’t travel anymore because other countries can see this information and they reject or arrest me?

I’m scared that my future employers will find out or society will find out and I’ll be shamed and rejected forever. To make things worse, I suffer from real event OCD where I think I’ve done something wrong even though deep down I know I’m innocent. So I had a huge real event OCD compulsion and told her that there are things that I haven’t confessed to her. She didn’t ask me for any confessions or elaboration on this. But I feel like I dug myself a deeper hole by saying this.

I feel like I’ve destroyed my life. I want to die. I can’t live with these fears anymore. It’s my birthday in two days and I don’t see any point in celebrating because I’ve destroyed my life by doing this anyway.",18,0
